2636.txt,an instance of,the optimization problem in x can be seen as an instance of the maximum cut problem with an additional cardinality constraint,O O O O O O O O O B I I O O O O O O O O O,DT NN NN IN NN MD VB VBN IN DT NN IN DT NN NN NN IN DT JJ NN NN
2637.txt,solve this combinatorial problem,the two main approaches to solve this combinatorial problem are either to use the linear programming relaxation by linearizing the product of two binary variables or the semidefinite programming relaxation suggested in x the sdp ing approximation algorithms,O O O O O B I I I O O O O O O O O O O O O O O O O O O O O O O O O O O O O O,DT CD JJ NNS TO VB DT JJ NN VBP CC TO VB DT JJ NN NN IN VBG DT NN IN CD JJ NNS CC DT JJ NN NN VBD IN NN DT FW FW NN NNS
2642.txt,it is essential to,it is essential to be able to directly examine it,B I I I O O O O O O,PRP VBZ JJ TO VB JJ TO RB VB PRP
2643.txt,it is not possible to,however since estimating the exact mutual information value in real data is not feasible it is not possible to directly evaluate the measure function,O O O O O O O O O O O O O O B I I I I O O O O O,RB IN VBG DT JJ JJ NN NN IN JJ NNS VBZ RB JJ PRP VBZ RB JJ TO RB VB DT NN NN
2647.txt,contributes to,that is besides the quality of a measure function the inaccuracy of the search strategy also contributes to the final classification error,O O O O O O O O O O O O O O O O B I O O O O,DT VBZ IN DT NN IN DT NN NN DT NN IN DT NN NN RB VBZ TO DT JJ NN NN
2648.txt,in order to draw a conclusion concerning,thus in order to draw a conclusion concerning the quality of a measure function,O B I I I I I I O O O O O O,RB IN NN TO VB DT NN VBG DT NN IN DT NN NN
2649.txt,compare with,in this section we compare the accuracy of the proposed method with the traditional backward elimination approach,O O O O B O O O O O O I O O O O O,IN DT NN PRP VBP DT NN IN DT VBN NN IN DT JJ RB NN NN
2650.txt,the accuracy of,a standard approach to investigate the accuracy of an optimization algorithm is by analyzing how close it gets to the optimal solution,O O O O O B I I O O O O O O O O O O O O O O,DT JJ NN TO VB DT NN IN DT NN NN VBZ IN VBG WRB JJ PRP VBZ TO DT JJ NN
2651.txt,is only feasible for,unfortunately feature selection is an np hard problem and thus achieving the optimal solution to use as reference is only feasible for small sized problems,O O O O O O O O O O O O O O O O O O B I I I O O O,RB NN NN VBZ DT JJ JJ NN CC RB VBG DT JJ NN TO VB IN NN VBZ RB JJ IN JJ VBN NNS
2655.txt,that is to say,k hsp is an instance of the maxcut problem with a cardinality constraint on the selected subset that is to say to determine a subset s of k vertices such that the weight of the subgraph induced by s is maximized,O O O O O O O O O O O O O O O O O B I I I O O O O O O O O O O O O O O O O O O O O,NN NN VBZ DT NN IN DT NN NN IN DT NN NN IN DT VBN NN WDT VBZ TO VB TO VB DT NN NN IN NN NNS JJ IN DT NN IN DT NN VBN IN NN VBZ VBN
2656.txt,it is clear that,from the definition of k hsp it is clear that ssp with the criterion x is equivalent to the p heaviest subgraph problem since it selects the heaviest subset of features with the cardinality p,O O O O O O B I I I O O O O O O O O O O O O O O O O O O O O O O O O O,IN DT NN IN NN NN PRP VBZ JJ IN NN IN DT NN NN VBZ JJ TO DT NN JJS NN NN IN PRP VBZ DT JJS NN IN NNS IN DT NN NN
2659.txt,been listed in,the approximation ratios of both algorithms for different values of p as a function of n have been listed in table 1,O O O O O O O O O O O O O O O O O B I I O O,DT NN NNS IN DT NNS IN JJ NNS IN NN IN DT NN IN NN VBP VBN VBN IN NN CD
2660.txt,as can be seen,as can be seen as p becomes smaller the approximation ratio approaches zero yielding the trivial lower bound 0 on the approximate solution,B I I I O O O O O O O O O O O O O O O O O O O,IN MD VB VBN IN NN VBZ JJR DT NN NN NNS VBP VBG DT JJ JJR VBD CD IN DT JJ NN
2661.txt,it is bounded,however for larger values of p the approximation ratio is nontrivial since it is bounded away from zero,O O O O O O O O O O O O B I I O O O,RB IN JJR NNS IN NN DT NN NN VBZ JJ IN PRP VBZ VBN RB IN NN
2663.txt,we may conclude that,thus we may conclude that cobra is more likely to achieve better approximate solution than be,O B I I I O O O O O O O O O O O,RB PRP MD VB DT NN VBZ RBR JJ TO VB RBR JJ NN IN VB
2664.txt,focus on,in the following section we will focus on comparing our search algorithm with sequential search methods in conjunction with different measure functions and over different classifiers and datasets,O O O O O O B I O O O O O O O O O O O O O O O O O O O O,IN DT VBG NN PRP MD VB IN VBG PRP$ NN NN IN JJ NN NNS IN NN IN JJ NN NNS CC IN JJ NNS CC NNS
2665.txt,there is no direct way to,the evaluation of a feature selection algorithm is an intrinsically difficult task since there is no direct way to evaluate the goodness of a selection process in general,O O O O O O O O O O O O O B I I I I I O O O O O O O O O,DT NN IN DT NN NN NN VBZ DT RB JJ NN IN EX VBZ DT JJ NN TO VB DT NN IN DT NN NN IN JJ
2666.txt,based on,thus usually a selection algorithm is scored based on the performance of its output i e the selected feature subset in some specific classification system,O O O O O O O B I O O O O O O O O O O O O O O O O,RB RB DT NN NN VBZ VBN VBN IN DT NN IN PRP$ NN FW LS DT VBN NN NN IN DT JJ NN NN
2667.txt,be referred to,this kind of evaluation can be referred to as the goal dependent evaluation,O O O O O B I I O O O O O,DT NN IN NN MD VB VBN TO IN DT NN JJ NN
2670.txt,compare with,thus for evaluation of the feature selection algorithms we propose to compare the algorithms over different datasets with multiple classifiers,O O O O O O O O O O O B O O O O O I O O,RB IN NN IN DT NN NN NNS PRP VBP TO VB DT NNS IN JJ NNS IN JJ NNS
2671.txt,leads to,this method leads to a more classifier independent evaluation process,O O B I O O O O O O,DT NN VBZ TO DT JJR NN JJ NN NN
2672.txt,are listed in,some properties of the eight datasets used in the experiments are listed in table 2,O O O O O O O O O O B I I O O,DT NNS IN DT CD NNS VBN IN DT NNS VBP VBN IN NN CD
2673.txt,are available on,all datasets are available on the uci machine learning archive,O O B I I O O O O O,DT NNS VBP JJ IN DT NN NN NN NN
2674.txt,have been widely used in,these datasets have been widely used in previous feature selection studies,O O B I I I I O O O O,DT NNS VBP VBN RB VBN IN JJ NN NN NNS
2675.txt,is evaluated with,the goodness of each feature set is evaluated with five classifiers including support vector machine,O O O O O O B I I O O O O O O,DT NN IN DT NN NN VBZ VBN IN CD NNS VBG NN NN NN
2678.txt,except for,to derive the classification accuracies 10 fold cross validation is performed except for the nci dbw and lng datasets where leave one out cross validation is used,O O O O O O O O O O O B I O O O O O O O O O O O O O O,TO VB DT NN NNS CD JJ NN NN VBZ VBN IN IN DT FW FW CC NN NNS WRB NN CD RP JJ NN VBZ VBN
2679.txt,consist of,as explained before filter based methods consist of two components a measure function and a search strategy,O O O O O O B I O O O O O O O O O,IN VBN IN NN JJ NNS VBP IN CD NNS DT NN NN CC DT NN NN
2680.txt,use for,the measure functions we use for our experiments are mrmr and jmi defined in,O O O O B I O O O O O O O O,DT NN NNS PRP VBP IN PRP$ NNS VBP NN CC NN VBN IN
2681.txt,it is denoted,to unambiguously refer to an algorithm it is denoted by measure function search method used in that algorithm,O O O O O O B I I O O O O O O O O O,TO RB VB TO DT NN PRP VBZ VBN IN NN NN NN NN VBN IN DT NN
2682.txt,was used to,friedman test with the corresponding wilcoxonnemenyi post hoc analysis was used to compare the different algorithms,O O O O O O O O O B I I O O O O,NN NN IN DT JJ JJ NN FW NN VBD VBN TO VB DT JJ NNS
2683.txt,are marked in,however looking at the classification rates even before running the friedman tests on them reveals a few interesting points which are marked in bold font,O O O O O O O O O O O O O O O O O O O O B I I O O,RB VBG IN DT NN NNS RB IN VBG DT NN NNS IN PRP VBZ DT JJ JJ NNS WDT VBP JJ IN JJ NN
2684.txt,shows higher performance,first on the small size datasets mrmr cobra consistently shows higher performance than other algorithms,O O O O O O O O O B I I O O O,RB IN DT JJ NN FW FW NN RB VBZ JJR NN IN JJ NNS
2685.txt,it is clear that,from its definition it is clear that for be and fs this ratio is always equal to 1,O O O B I I I O O O O O O O O O O O,IN PRP$ NN PRP VBZ JJ IN IN VB CC VB DT NN VBZ RB JJ TO CD
2686.txt,because of,however because of the randomization step this ratio may widely vary for cobra,O B I O O O O O O O O O O,RB IN IN DT NN NN DT NN MD RB VB IN NN
2688.txt,compared with,some of these feature sets have relatively low scores as compared with be or fs sets,O O O O O O O O O O B I O O O O,DT IN DT NN NNS VBP RB JJ NNS IN VBN IN VB CC VB NNS
2689.txt,be better for,however since for small datasets the estimated mutual information terms are highly inaccurate features that rank low with our noisy measure function may in fact be better for classification,O O O O O O O O O O O O O O O O O O O O O O O O O B I I O,RB IN IN JJ NNS DT VBN JJ NN NNS VBP RB JJ NNS WDT VBP JJ IN PRP$ JJ NN NN MD IN NN VB JJR IN NN
2690.txt,with respect to,the second interesting point is with respect to the madelon dataset,O O O O O B I I O O O,DT JJ JJ NN VBZ IN NN TO DT NN NN
2691.txt,as can be seen,as can be seen mrmr with greedy search algorithms perform poorly on this dataset,B I I I O O O O O O O O O O,IN MD VB VBN NN IN JJ NN NNS VBP RB IN DT NN
2692.txt,arrived at the conclusion,several authors have already utilized this dataset to compare their proposed criterion with mrmr and arrived at the conclusion that mrmr cannot handle highly correlated features as in madelon dataset,O O O O O O O O O O O O O O O B I I I O O O O O O O O O O O,JJ NNS VBP RB VBN DT NN TO VB PRP$ VBN NN IN NN CC VBD IN DT NN IN FW FW VB RB VBN NNS IN IN NN NN
2693.txt,has difficulty to,however surprisingly the performance of the mrmr cobra is as good as jmi on this dataset meaning that it is not the criterion but the search method that has difficulty to deal with highly correlated features,O O O O O O O O O O O O O O O O O O O O O O O O O O O O B I I O O O O O,RB RB DT NN IN DT NN NN VBZ RB JJ IN NN IN DT NN VBG IN PRP VBZ RB DT NN CC DT NN NN WDT VBZ NN TO VB IN RB VBN NNS
2694.txt,with respect to,thus any conclusion with respect to the quality of a measure has to be drawn carefully since,O O O B I I O O O O O O O O O O O,RB DT NN IN NN TO DT NN IN DT NN VBZ TO VB VBN RB IN
2695.txt,as suggested in,to discover the statistically meaningful differences between the algorithms we applied the friedman test following with wilcoxon nemenyi post hoc analysis as suggested in x on the average accuracies,O O O O O O O O O O O O O O O O O O O O O B I I O O O O O,TO VB DT RB JJ NNS IN DT NNS PRP VBD DT NN NN VBG IN FW FW NN FW NN IN VBN IN NN IN DT JJ NNS
2696.txt,available for,note that since we have 8 datasets there are 8 independent measurements available for each algorithm,O O O O O O O O O O O O B I O O,NN IN IN PRP VBP CD NNS EX VBP CD JJ NNS JJ IN DT NN
2697.txt,been depicted in,the results of this test for mrmr based algorithms have been depicted in figure 2,O O O O O O O O O O B I I O O,DT NNS IN DT NN IN JJ JJ NNS VBP VBN VBN IN NN CD
2698.txt,stands for,in all box plots co stands for cobra algorithm,O O O O O B I O O,IN DT NN NNS VBP NNS IN NN NN
2700.txt,a significant difference between,the green box plots represent the existence of a significant difference between the corresponding algorithms,O O O O O O O O B I I I O O O,DT JJ NN NNS VBP DT NN IN DT JJ NN IN DT JJ NNS
2701.txt,been reported in,the adjusted pvalues for each pair of algorithms have also been reported in figure 2,O O O O O O O O O O B I I O O,DT JJ NNS IN DT NN IN NNS VBP RB VBN VBN IN NN CD
2704.txt,its results can be found in,the same test was run for each classifier and its results can be found in figure 3,O O O O O O O O O B I I I I I O O,DT JJ NN VBD VBN IN DT NN CC PRP$ NNS MD VB VBN IN NN CD
2705.txt,between and,while three of the classifiers show some differences between fs and cobra neither of them reveal any meaningful difference between be and cobra,O O O O O O O O B O I O O O O O O O O O O O O,IN CD IN DT NNS VBP DT NNS IN NNS CC NN CC IN PRP VBP DT JJ NN IN VB CC NN
2706.txt,it is a good chance that,at this point the least we can conclude is that independent of the classification algorithm we choose it is a good chance that fs performs worse than cobra,O O O O O O O O O O O O O O O O O B I I I I I O O O O O,IN DT NN DT JJS PRP MD VB VBZ IN JJ IN DT NN NN PRP VBP PRP VBZ DT JJ NN WDT VBZ VBZ JJR IN NN
2707.txt,it is difficult to,for jmi however the performances of all algorithms are comparable and with only 8 datasets it is difficult to draw any conclusion,O O O O O O O O O O O O O O O B I I I O O O,IN NN RB DT NNS IN DT NNS VBP JJ CC IN RB CD NNS PRP VBZ JJ TO VB DT NN
2708.txt,because of,thus the wilcoxon nemenyi test results for jmi is not shown here because of the lack of space,O O O O O O O O O O O O B I O O O O,RB DT FW FW NN NNS IN NN VBZ RB VBN RB IN IN DT NN IN NN
2709.txt,smaller than,as seen for nci the averaged similarity ratio is significantly smaller than 1 while for cna which is a relatively larger dataset employ quadratic programing techniques to maximize a score function,O O O O O O O O O O B I O O O O O O O O O O O O O O O O O O O,IN VBN IN NN DT VBN NN NN VBZ RB JJR IN CD NN IN NN WDT VBZ DT RB JJR NN VBP JJ VBG NNS TO VB DT NN NN
2710.txt,an instance of,soss however uses an instance of randomized rounding to generate the set membership binary,O O O B I I O O O O O O O O,NN RB VBZ DT NN IN VBN VBG TO VB DT VBN NN JJ
2711.txt,comparison with,comparison of cobra with the greedy search methods over different datasets,B O O I O O O O O O O,NN IN NN IN DT JJ NN NNS IN JJ NNS
2713.txt,the average of,the last column reports the average of the classification accuracies for each algorithm,O O O O B I I O O O O O O,DT JJ NN VBZ DT NN IN DT NN NNS IN DT NN
2714.txt,comparison with,comparison of cobra with qpfs and soss over 5 datasets,B O O I O O O O O O,NN IN NN IN NNS CC NN IN CD NNS
2715.txt,are reported in,average classification rates and their standard deviations are reported in the top three rows of the table,O O O O O O O B I I O O O O O O O,JJ NN NNS CC PRP$ JJ NNS VBP VBN IN DT JJ CD NNS IN DT NN
2717.txt,comparing with,comparing the search strategies for mrmr measure with the friedman test and its corresponding post hoc analysis,B O O O O O O I O O O O O O O O O,VBG DT NN NNS IN NN NN IN DT NN NN CC PRP$ JJ NN FW NN
2719.txt,based on,values while qpfs ranks the features based on their scores and therefore sidesteps the difficulties of generating binary values,O O O O O O B I O O O O O O O O O O O,NNS IN NNS VBZ DT NNS VBN IN PRP$ NNS CC RB VBZ DT NNS IN VBG JJ NNS
2720.txt,both and,note that both cobra and soss first need to calculate the mutual information matrix q,O O B O I O O O O O O O O O O,NN IN CC NN CC NN JJ NN TO VB DT JJ NN NN NN
2723.txt,consist of,the reported times for cobra and soss consist of two values,O O O O O O O B I O O,DT VBN NNS IN NN CC NN VBP IN CD NNS
2727.txt,such as,for large datasets such as iad cna and mad the nystrom approximation used in qpfs to cast the problem into a lower dimensional subspace does not yield a precise enough approximation,O O O B I O O O O O O O O O O O O O O O O O O O O O O O O O O,IN JJ NNS JJ IN NN NN CC JJ DT NN NN VBN IN NNS TO VB DT NN IN DT JJR JJ NN VBZ RB VB DT JJ JJ NN
2729.txt,as mentioned in,thus the dimension is 2000 and not 9703 as mentioned in table 2,O O O O O O O O B I I O O,RB DT NN VBZ CD CC RB CD IN VBN IN NN CD
2731.txt,as can be observed in,as can be observed in table 4 the number of selected features varies quite markedly from one classifier to another,B I I I I O O O O O O O O O O O O O O O,IN MD VB VBN IN NN CD DT NN IN VBN NNS VBZ RB RB IN CD NN TO DT
2732.txt,based on,however based on our experiments the optimum feature set of any of the classifiers usually achieves a near optimal accuracy in conjunction with other classifiers as well,O B I O O O O O O O O O O O O O O O O O O O O O O O O,RB VBN IN PRP$ NNS DT JJ NN NN IN DT IN DT NNS RB VBZ DT JJ JJ NN IN NN IN JJ NNS RB RB
2733.txt,this is shown in,this is shown in table 7 for 4 classifiers and 3 datasets,B I I I O O O O O O O O,DT VBZ VBN IN NN CD IN CD NNS CC CD NNS
2736.txt,in the case of,unlike the cna and iad datasets a significant accuracy reduction can be observed in the case of arr data which has substantially less training data than cna and iad,O O O O O O O O O O O O O B I I I O O O O O O O O O O O O,IN DT NN CC NN NNS DT JJ NN NN MD VB VBN IN DT NN IN NN NNS WDT VBZ RB JJR NN NNS IN NN CC NN
2737.txt,it suggests that,it suggests that for small size datasets a feature selection scheme should take the induction algorithm into account since the learning algorithm is sensitive to small changes of the feature set,B I I O O O O O O O O O O O O O O O O O O O O O O O O O O O O,PRP VBZ IN IN JJ NN VBZ DT NN NN NN MD VB DT NN NN IN NN IN DT NN NN VBZ JJ TO JJ NNS IN DT NN NN
2739.txt,compared with,its approximation ratio was derived and compared with the approximation ratio of the backward elimination method,O O O O O O B I O O O O O O O O,PRP$ NN NN VBD VBN CC VBN IN DT NN NN IN DT RB NN NN
2740.txt,it was experimentally shown that,it was experimentally shown that cobra outperforms sequential search methods especially in the case of sparse data,B I I I I O O O O O O O O O O O O,PRP VBD RB VBN IN NN VBZ JJ NN NNS RB IN DT NN IN JJ NNS
2742.txt,it was shown that,furthermore the underlying connection between mifs and the kirwood approximation was explored and it was shown that by adopting the class conditional independence assumption and the kirkwood approximation for mutual information reduces to the mifs criterion,O O O O O O O O O O O O O B I I I O O O O O O O O O O O O O O O O O O O,RB DT VBG NN IN NNS CC DT NN NN VBD VBN CC PRP VBD VBN IN IN VBG DT NN JJ NN NN CC DT NN NN IN JJ NN VBZ TO DT NNS NN
2743.txt,has partly been supported by,this work has partly been supported by swiss national science foundation,O O B I I I I O O O O,DT NN VBZ RB VBN VBN IN JJ JJ NN NN
2745.txt,are able to,supervised hashing aims to map the original features to compact binary codes that are able to preserve label based similarity in the binary hamming space,O O O O O O O O O O O O O B I I O O O O O O O O O,VBN VBG NNS TO VB DT JJ NNS TO JJ JJ NNS WDT VBP JJ TO VB NN JJ NN IN DT JJ VBG NN
2747.txt,are difficult to solve,this tight coupling restricts the flexibility of those methods and can result in complex optimization problems that are difficult to solve,O O O O O O O O O O O O O O O O O B I I I,DT JJ NN VBZ DT NN IN DT NNS CC MD VB IN JJ NN NNS WDT VBP JJ TO VB
2748.txt,is able to,in this work we proffer a flexible yet simple framework that is able to accommodate different types of loss functions and hash functions,O O O O O O O O O O O B I I O O O O O O O O O,IN DT NN PRP VBP DT JJ RB JJ NN WDT VBZ JJ TO VB JJ NNS IN NN NNS CC VB NNS
2751.txt,be accomplished by,the first step can typically be formulated as binary quadratic problems and the second step can be accomplished by training standard binary classifiers,O O O O O O O O O O O O O O O O B I I O O O O,DT JJ NN MD RB VB VBN IN JJ JJ NNS CC DT JJ NN MD VB VBN IN VBG JJ JJ NNS
2752.txt,it is possible to,for solving large scale binary code inference we show how it is possible to ensure the binary quadratic problems to be submodular such that an efficient graph cuts can be used,O O O O O O O O O O B I I I O O O O O O O O O O O O O O O O O,IN VBG JJ NN JJ NN NN PRP VBP WRB PRP VBZ JJ TO VB DT JJ JJ NNS TO VB JJ JJ IN DT JJ NN NNS MD VB VBN
2753.txt,are very fast to,we propose to use boosted decision trees as the hash functions which are nonlinear and highly descriptive and are very fast to train and evaluate,O O O O O O O O O O O O O O O O O O B I I I O O O,PRP VBP TO VB VBN NN NNS IN DT JJ NNS WDT VBP JJ CC RB JJ CC VBP RB JJ TO VB CC VB
2755.txt,in terms of,it becomes more and more demanding to cope with image datasets with tens of millions of images in terms of both efficient storage and computing,O O O O O O O O O O O O O O O O O B I I O O O O O,PRP VBZ RBR CC RBR VBG TO VB IN NN NNS IN NNS IN NNS IN NNS IN NNS IN CC JJ NN CC NN
2758.txt,are extremely efficient for,moreover compact binary codes are extremely efficient for large scale data storage or network transfer,O O O O B I I I O O O O O O O,RB JJ JJ NNS VBP RB JJ IN JJ NN NNS NN CC NN NN
2759.txt,on the basis of,loss functions for learning based hashing are typically defined on the basis of the hamming distance or hamming affinity of similar and dissimilar data pairs,O O O O O O O O O B I I I O O O O O O O O O O O O,NN NNS IN VBG VBN VBG VBP RB VBN IN DT NN IN DT VBG NN CC VBG NN IN JJ CC JJ NNS NNS
2761.txt,is then coupled with,the optimization procedure is then coupled with the selected family of hash functions,O O O B I I I O O O O O O,DT NN NN VBZ RB VBN IN DT VBN NN IN JJ NNS
2764.txt,be very challenging to,this coupling often results in a highly non convex optimization problem which can be very challenging to optimize,O O O O O O O O O O O O O B I I I O,DT NN RB VBZ IN DT RB JJ NN NN NN WDT MD VB RB JJ TO VB
2765.txt,aims to,as an example the loss functions in mdsh ksh and bre all take a similar form that aims to minimize the difference between the hamming affinity of data pairs and the ground truth,O O O O O O O O O O O O O O O O O B I O O O O O O O O O O O O O O,IN DT NN DT NN NNS IN FW FW CC VB DT VB DT JJ NN WDT VBZ TO VB DT NN IN DT VBG NN IN NN NNS CC DT NN NN
2766.txt,is able to,our framework however is able to accommodate any loss functions which are defined on the hamming distance affinity of data pairs,O O O B I I O O O O O O O O O O O O O O O,PRP$ NN RB VBZ JJ TO VB DT NN NNS WDT VBP VBN IN DT VBG NN NN IN NNS NNS
2768.txt,are unified into,we can formulate the optimization problem of any hamming distance affinity based loss as binary quadratic problems hence different types of loss functions are unified into the same optimization problem which significantly simplifies the optimization,O O O O O O O O O O O O O O O O O O O O O O O B I I O O O O O O O O O,PRP MD VB DT NN NN IN DT VBG NN NN JJ NN IN JJ JJ NNS RB JJ NNS IN NN NNS VBP VBN IN DT JJ NN NN WDT RB VBZ DT NN
2769.txt,are only tractable for,many supervised hashing approaches usually require complex optimization for directly learning hash functions hence they are only tractable for small scale training data,O O O O O O O O O O O O O O O B I I I O O O O,JJ JJ VBG NNS RB VBP JJ NN IN RB VBG JJ NNS RB PRP VBP RB JJ IN JJ NN NN NNS
2771.txt,are essential for,the recent advance of feature learning shows that high dimensional features are essential for achieving good performance,O O O O O O O O O O O B I I O O O,DT JJ NN IN NN NN VBZ IN JJ JJ NNS VBP JJ IN VBG JJ NN
2772.txt,for example,for example the dimension of codebook based features usually comes to tens of thousands,B I O O O O O O O O O O O O,IN NN DT NN IN NN VBN NNS RB VBZ TO NNS IN NNS
2774.txt,have shown much improved performance over,non linear hash functions e g the kernel hash function employed in ksh have shown much improved performance over the linear hash function,O O O O O O O O O O O O O B I I I I I O O O O,JJ JJ JJ NNS SYM NN DT NN NN NN VBN IN NN VBP VBN RB VBN NN IN DT JJ NN NN
2777.txt,compared to,compared to kernel method decision trees only involve simple comparison operations,B I O O O O O O O O O,VBN TO NN NN NN NNS RB VBP JJ NN NNS
2778.txt,the main contributions of this work are as follows,the main contributions of this work are as follows,B I I I I I I I I,DT JJ NNS IN DT NN VBP IN VBZ
2781.txt,such as,an arbitrary classifier such as linear or kernel svm boosting neural networks,O O O B I O O O O O O O,DT JJ NN JJ IN NN CC NN NN VBG JJ NNS
2782.txt,are able to,we are able to incorporate various types of loss functions in a unified manner,O B I I O O O O O O O O O O,PRP VBP JJ TO VB JJ NNS IN NN NNS IN DT JJ NN
2783.txt,solve a problem,we show that any type of loss function defined on hamming affinity or hamming distance can be equivalently converted into a standard quadratic function thus we can solve a standard binary quadratic problem for binary code inference,O O O O O O O O O O O O O O O O O O O O O O O O O O O B I O O O I O O O O,PRP VBP IN DT NN IN NN NN VBN IN VBG NN CC VBG NN MD VB RB VBN IN DT JJ JJ NN RB PRP MD VB DT JJ JJ JJ NN IN JJ NN NN
2785.txt,deal with,we propose to use decision trees as hash functions for supervised hashing which can easily deal with a very large number of high dimensional training data and has the desirable non linear mapping,O O O O O O O O O O O O O O O B I O O O O O O O O O O O O O O O O,PRP VBP TO VB NN NNS IN JJ NNS IN VBN VBG WDT MD RB VB IN DT RB JJ NN IN JJ JJ NN NNS CC VBZ DT JJ JJ JJ NN
2786.txt,in terms of,our method significantly outperforms many existing methods in terms of retrieval accuracy,O O O O O O O B I I O O,PRP$ NN RB VBZ JJ VBG NNS IN NNS IN NN NN
2787.txt,orders of,for high dimensional data our method is also orders of magnitude faster for training,O O O O O O O O B I O O O O,IN JJ JJ NNS PRP$ NN VBZ RB NNS IN NN RBR IN NN
2788.txt,aim to,hashing methods aim to preserve some notion of similarity in the hamming space,O O B I O O O O O O O O O,VBG NNS VBP TO VB DT NN IN NN IN DT VBG NN
2789.txt,for example,for example locality sensitive hashing generates random linear hash functions to approximate cosine similarity,B I O O O O O O O O O O O O,IN NN NN JJ VBG VBZ JJ JJ NN NNS TO JJ NN NN
