957.txt,there are mainly two approaches to,there are mainly two approaches to check the liveness of input iris images in the literature,B I I I I I O O O O O O O O O O,EX VBP RB CD NNS TO VB DT NN IN NN NN NNS IN DT NN
961.txt,based on,an alternative approach is to check the liveness characteristics of iris images based on texture analysis which has the advantage of independence of iris sensors,O O O O O O O O O O O O B I O O O O O O O O O O O,DT JJ NN VBZ TO VB DT NN NNS IN NN NNS VBN IN NN NN WDT VBZ DT NN IN NN IN NN NNS
963.txt,were also used for,quality based image measures were also used for iris liveness detection,O O O O B I I I O O O,NN JJ NN NNS VBD RB VBN IN NN NN NN
964.txt,be used for,genuine and fake iris images have distinctive texture patterns therefore well developed texture analysis and pattern classification methods can be used for iris liveness detection,O O O O O O O O O O O O O O O O O O O B I I O O O,JJ CC JJ NN NNS VBP JJ NN NNS RB RB VBN NN NN CC NN NN NNS MD VB VBN IN NN NN NN
967.txt,based on,some attempts have been made to perform race classification based on biometric images,O O O O O O O O O B I O O,DT NNS VBP VBN VBN TO VB NN NN VBN IN JJ NNS
968.txt,such as,most of the early work is based on facial images such as the work in x,O O O O O O O O O O B I O O O O,JJS IN DT JJ NN VBZ VBN IN JJ NNS JJ IN DT NN IN NN
969.txt,it is intuitive that,it is intuitive that visual appearance of human iris is related to racial information,B I I I O O O O O O O O O O,PRP VBZ JJ IN JJ NN IN JJ NN VBZ JJ TO JJ NN
970.txt,for example,for example eyes of western subjects usually exhibit bright and colorful iris appearance with clear texture patterns,B I O O O O O O O O O O O O O O O,IN NN NNS IN JJ NNS RB VBP JJ CC JJ NN NN IN JJ NN NNS
971.txt,it is impossible to,in contrast eyes of most asian subjects show brown or dark appearance and it is impossible to obtain detailed texture information in visible lighting,O O O O O O O O O O O O O B I I I O O O O O O O,IN NN NNS IN JJS JJ NNS VBP JJ CC JJ NN CC PRP VBZ JJ TO VB JJ NN NN IN JJ NN
973.txt,are unique to,the phenotypic features of iris biometrics are mainly illustrated in local details of iris texture patterns which are unique to each subject,O O O O O O O O O O O O O O O O O B I I O O,DT JJ NNS IN NN NNS VBP RB VBN IN JJ NNS IN NN NN NNS WDT VBP JJ TO DT NN
975.txt,addresses the problem of,although we can observe the similarity in both color and texture of iris images between generelated human eyes this paper mainly addresses the problem of automatic race classification based on iris texture features,O O O O O O O O O O O O O O O O O O O O O B I I I O O O O O O O O,IN PRP MD VB DT NN IN CC NN CC NN IN NN NNS IN VBN JJ NNS DT NN RB VBZ DT NN IN JJ NN NN VBN IN NN NN NNS
979.txt,based on,so we developed a specific visual vocabulary namely iris texton to classify asian and non asian subjects based on iris images,O O O O O O O O O O O O O O O O O B I O O,RB PRP VBD DT JJ JJ NN RB VBZ NN TO VB JJ CC JJ JJ NNS VBN IN NN NNS
983.txt,is used to,as a unique and stable biometric modality iris pattern is used to identify large population in many government and commercial applications,O O O O O O O O O B I I O O O O O O O O O,IN DT JJ CC JJ JJ NN NN NN VBZ VBN TO VB JJ NN IN JJ NN CC JJ NNS
984.txt,less than,however large scale iris identification can be much less accurate and less efficient than is commonly believed,O O O O O O O O B O O O O I O O O,RB JJ NN NN NN MD VB RB RBR JJ CC RBR JJ IN VBZ RB VBN
985.txt,based on,a possible solution to speed up large scale iris identification is to classify the large database into a number of categories based on iris texture,O O O O O O O O O O O O O O O O O O O O O B I O O,DT JJ NN TO VB RP JJ NN NN NN VBZ TO VB DT JJ NN IN DT NN IN NNS VBN IN NN NN
987.txt,it can improve the accuracy of,it can improve the accuracy of iris recognition by integrating global texture information in classification stage and local texture features in recognition stage,B I I I I I O O O O O O O O O O O O O O O O O,PRP MD VB DT NN IN NN NN IN VBG JJ NN NN IN NN NN CC JJ NN NNS IN NN NN
988.txt,proposed for,there are a few iris image classification methods proposed for coarse iris image classification,O O O O O O O O B I O O O O,EX VBP DT JJ NN NN NN NNS VBN IN JJ NN NN NN
993.txt,compared with,compared with iris recognition iris image classification has not been well defined and addressed in the literature,B I O O O O O O O O O O O O O O O,VBN IN NN NN VBZ NN NN VBZ RB VBN RB VBN CC VBN IN DT NN
994.txt,related to,existing research work related to iris image classification is scattered in pieces for specific problems,O O O B I O O O O O O O O O O,VBG NN NN VBN TO VB NN NN VBZ VBN IN NNS IN JJ NNS
995.txt,attempt to,in this paper we attempt to provide a systematic study of the iris image classification,O O O O B I O O O O O O O O O,IN DT NN PRP VBP TO VB DT JJ NN IN DT NN NN NN
996.txt,the main contributions of our work are,the main contributions of our work are summarized as follows,B I I I I I I O O O,DT JJ NNS IN PRP$ NN VBP VBN IN VBZ
997.txt,addresses the problem of,this paper systematically addresses the problem of iris image classification including its definition core problems challenges and applications,O O O B I I I O O O O O O O O O O O,DT NN RB VBZ DT NN IN NN NN NN VBG PRP$ NN NN NNS NNS CC NNS
998.txt,based on,we propose a general framework for iris image classification based on statistical texture analysis,O O O O O O O O O B I O O O,PRP VBP DT JJ NN IN NN NN NN VBN IN JJ NN NN
999.txt,are unifind into,three typical applications of iris image classification are unifind into the general framework,O O O O O O O B I I O O O,CD JJ NNS IN NN NN NN VBP JJ IN DT JJ NN
1001.txt,in addition,in addition a common module of iris image classification can be developed for iris recognition systems for various applications inspired by the general framework,B I O O O O O O O O O O O O O O O O O O O O O O,IN NN DT JJ NN IN NN NN NN MD VB VBN IN NN NN NNS IN JJ NNS VBN IN DT JJ NN
1002.txt,is proposed to,a novel texture pattern representation method called hierarchical visual codebook is proposed to encode the distinctive and robust texture primitives of iris images,O O O O O O O O O O B I I O O O O O O O O O O,DT JJ NN NN NN NN VBN JJ JJ NN VBZ VBN TO VB DT JJ CC JJ NN NNS IN NN NNS
1004.txt,it performs well in,it performs well in typical applications of iris image classification and the results prove that bag of words model is well suited for iris image classification,B I I I O O O O O O O O O O O O O O O O O O O O O O,PRP VBZ RB IN JJ NNS IN NN NN NN CC DT NNS VBP IN NN IN NNS NN VBZ RB VBN IN NN NN NN
1005.txt,in addition,in addition hvc provides a promising approach to learn class specific visual codebook for general image classification,B I O O O O O O O O O O O O O O O,IN NN NN VBZ DT JJ NN TO VB NN JJ JJ NN IN JJ NN NN
1007.txt,based on,the success of race classification based on iris images indicates that an iris image is not only a phenotypic biological signature but also a genotypic biometric pattern,O O O O O B I O O O O O O O O O O O O O O O O O O O O,DT NN IN NN NN VBN IN NN NNS VBZ IN DT NN NN VBZ RB RB DT JJ JJ NN CC RB DT JJ JJ NN
1013.txt,due to,the existing research of iris liveness detection are limited on detection of specific fake iris images printed on paper due to the lack of a universal benchmark containing a variety of fake iris patterns,O O O O O O O O O O O O O O O O O O O B I O O O O O O O O O O O O O,DT VBG NN IN NN NN NN VBP VBN IN NN IN JJ JJ NN NNS VBN IN NN JJ TO DT NN IN DT JJ NN VBG DT NN IN JJ NN NNS
1015.txt,is organized as follows,the remainder of this paper is organized as follows,O O O O O B I I I,DT NN IN DT NN VBZ VBN IN VBZ
1016.txt,is described in details,section 2 proposes a general framework for iris image classification and the proposed novel iris pattern representation method is described in details,O O O O O O O O O O O O O O O O O O B I I I,NN CD VBZ DT JJ NN IN NN NN NN CC DT VBN JJ NN NN NN NN VBZ VBN IN NNS
1019.txt,is proposed in,a general framework of iris image classification based on a novel texture pattern representation method called hierarchical visual codebook is proposed in this section as shown in fig,O O O O O O O O O O O O O O O O O O O B I I O O O O O O,DT JJ NN IN NN NN NN VBN IN DT JJ NN NN NN NN VBN JJ JJ NN VBZ VBN IN DT NN IN VBN IN NN
1021.txt,based on,the framework mainly includes four modules iris image preprocessing low level visual feature extraction statistical iris image representation based on hvc model iris image classification,O O O O O O O O O O O O O O O O O O B I O O O O O,DT NN RB VBZ CD NNS VBZ NN VBG JJ NN JJ NN NN JJ NN NN NN VBN IN NN NN VBZ NN NN
1025.txt,are normalized into,traditionally iris images are normalized into polar coordinate system,O O O B I I O O O,RB NN NNS VBP VBN IN JJ JJ NN
1031.txt,propose to,in this paper we propose to use dense sift descriptors as the low level features for iris image classification,O O O O B I O O O O O O O O O O O O O,IN DT NN PRP VBP TO VB JJ VBP NNS IN DT JJ NN NNS IN NN NN NN
1033.txt,is distinctive for,secondly the histogram derived from sift is distinctive for iris image classification,O O O O O O B I I O O O,RB DT NN VBN IN VBP VBZ JJ IN NN NN NN
1034.txt,is proven as,thirdly sift is proven as one of the most robust descriptors in image analysis,O O B I I O O O O O O O O O,RB VB VBZ VBN IN CD IN DT RBS JJ NNS IN NN NN
1036.txt,is divided into,in this paper sift descriptors are computed at local regions using a 16 window and each window is divided into 44 cells,O O O O O O O O O O O O O O O O O B I I O O,IN DT NN VB NNS VBP VBN IN JJ NNS VBG DT CD NN CC DT NN VBZ VBN IN CD NNS
1037.txt,results in,image gradients within each cell are quantized into a 8 bin histogram which results in a 128 d sift feature,O O O O O O O O O O O O O B I O O O O O,NN NNS IN DT NN VBP VBN IN DT CD NN NN WDT VBZ IN DT CD NN VB NN
1040.txt,it is suggested to,given the low level visual features it is suggested to obtain the statistical texture representation for iris image classification,O O O O O O B I I I O O O O O O O O O,VBN DT JJ NN JJ NNS PRP VBZ VBN TO VB DT JJ NN NN IN NN NN NN
1042.txt,is demonstrated as,bag of words model is demonstrated as the most popular statistical feature representation in object recognition,O O O O B I I O O O O O O O O O,NN IN NNS NN VBZ VBN IN DT RBS JJ JJ NN NN IN NN NN
1044.txt,the most important issue in,the most important issue in bow is visual codebook learning and coding,B I I I I O O O O O O O,DT RBS JJ NN IN NN VBZ JJ NN VBG CC VBG
1047.txt,compared with,compared with the visual signals in general object recognition or scene classification tasks iris images do not contain abundant structural information and the main visual features in iris patterns are texture information,B I O O O O O O O O O O O O O O O O O O O O O O O O O O O O O O,VBN IN DT JJ NNS IN JJ NN NN CC NN NN NNS VBP NNS VBP RB VB JJ JJ NN CC DT JJ JJ NNS IN NN NNS VBP NN NN
1048.txt,in addition,in addition the global texture features between various iris images are much more similar than the visual features between different objects or natural scene images,B I O O O O O O O O O O O O O O O O O O O O O O O,IN NN DT JJ NN NNS IN JJ NN NNS VBP RB RBR JJ IN DT JJ NNS IN JJ NNS CC JJ NN NNS
1049.txt,are distributed in,it indicates that the variations of iris textures are distributed in a relatively small part of the feature space,O O O O O O O O B I I O O O O O O O O,PRP VBZ IN DT NNS IN NN NNS VBP VBN IN DT RB JJ NN IN DT NN NN
1055.txt,be used to,therefore a larger vocabulary can be used to better model the visual contents of images with a much more efficient lookup of visual words,O O O O O B I I O O O O O O O O O O O O O O O O,RB DT JJR NN MD VB VBN TO JJR NN DT JJ NNS IN NNS IN DT RB RBR JJ NN IN JJ NNS
1056.txt,it is a good idea to,since iris images are rich of various texture primitives it is a good idea to extend the idea of vt to iris image classification,O O O O O O O O O B I I I I I O O O O O O O O O,IN NN NNS VBP JJ IN JJ NN NNS PRP VBZ DT JJ NN TO VB DT NN IN NN TO VB NN NN
1057.txt,is mainly contributed by,a success of a bag of words model is mainly contributed by a good visual codebook and a good visual coding strategy,O O O O O O O O B I I I O O O O O O O O O O,DT NN IN DT NN IN NNS NN VBZ RB VBN IN DT JJ JJ NN CC DT JJ JJ NN NN
1058.txt,is a good approach to,although vt is a good approach to build visual codebook the hard voting based vector quantization coding in vt is not a good visual coding strategy,O O B I I I I O O O O O O O O O O O O O O O O O O O,IN NN VBZ DT JJ NN TO VB JJ NN DT JJ NN VBN NN NN VBG IN NN VBZ RB DT JJ JJ NN NN
1059.txt,be introduced into,some coding errors may be introduced into visual representation because of the similarity of some visual words,O O O O B I I O O O O O O O O O O,DT VBG NNS MD VB VBN IN JJ NN IN IN DT NN IN DT JJ NNS
1060.txt,such as,so we prefer to a soft voting based visual coding strategy such as llc,O O O O O O O O O O O B I O,RB PRP VBP TO DT JJ NN VBN JJ VBG NN JJ IN NN
1062.txt,aims to,it aims to reconstruct visual features with locality constraint instead of sparsity constraint based on the following optimization criteria,O B I O O O O O O O O O O O O O O O O,PRP VBZ TO VB JJ NNS IN NN NN RB IN NN NN VBN IN DT VBG NN NNS
1063.txt,are not used for,in our approach the empty clusters obtained during hierarchical codebook learning are also represented with the same method as the real codes but these codes have value 0 and are not used for coding,O O O O O O O O O O O O O O O O O O O O O O O O O O O O O B I I I O,IN PRP$ NN DT JJ NNS VBN IN JJ NN NN VBP RB VBN IN DT JJ NN IN DT JJ NNS CC DT NNS VBP NN CD CC VBP RB VBN IN VBG
1064.txt,as an example to,in this section we use the three levels hierarchical visual codebook as an example to illustrate the coding algorithm,O O O O O O O O O O O B I I I O O O O,IN DT NN PRP VBP DT CD NNS JJ JJ NN IN DT NN TO VB DT VBG NN
1065.txt,it is easy to,it is easy to extend the example to the cases with more coding levels,B I I I O O O O O O O O O O,PRP VBZ JJ TO VB DT NN TO DT NNS IN JJR NN NNS
1066.txt,rather than,the hvc is integrated into the coding process rather than following a single path down of the vocabulary tree during the image representation phase,O O O O O O O O B I O O O O O O O O O O O O O O,DT NN VBZ VBN IN DT VBG NN RB IN VBG DT JJ NN IN IN DT NN NN IN DT NN NN NN
1068.txt,in the first level of,we initialize candidate nodes with all the nodes in the first level of b,O O O O O O O O B I I I I O,PRP VBP NN NNS IN PDT DT NNS IN DT JJ NN IN NN
1072.txt,it is clear that,it is clear that learning a small number of codes from a subset of feature pool is more efficient than learning a large number of codes from feature pool,B I I I O O O O O O O O O O O O O O O O O O O O O O O O O,PRP VBZ JJ IN VBG DT JJ NN IN NNS IN DT NN IN NN NN VBZ RBR JJ IN VBG DT JJ NN IN NNS IN NN NN
1075.txt,better than,it performs better than k means when the intra class variations are large and the inter class differences are small,O O B I O O O O O O O O O O O O O O O O,PRP VBZ JJR IN NN VBZ WRB DT JJ NN NNS VBP JJ CC DT NN NN NNS VBP JJ
1076.txt,is suitable for,the hierarchical k means is suitable for iris texture codebook learning since iris texture is highly random pattern but with relatively smaller variations than natural scene images,O O O O B I I O O O O O O O O O O O O O O O O O O O O,DT JJ NN NN VBZ JJ IN NN NN NN VBG IN NN NN VBZ RB JJ NN CC IN RB JJR NNS IN JJ NN NNS
1077.txt,play significant roles in,some texture primitives are seldom shown in the codebook learning but they play significant roles in the iris image classification task,O O O O O O O O O O O O B I I I O O O O O,DT NN NNS VBP RB VBN IN DT NN NN CC PRP VBP JJ NNS IN DT NN NN NN NN
1079.txt,in contrast,in contrast the hierarchical clustering strategy used in hvc is possible to reserve these visual codes in local feature space,B I O O O O O O O O O O O O O O O O O O,IN NN DT JJ NN NN VBN IN NN VBZ JJ TO VB DT JJ NNS IN JJ NN NN
1081.txt,between and,the tree structure represents some relationships between the codes and creates overlapping partitions of feature spaces,O O O O O O B O O I O O O O O O,DT NN NN VBZ DT NNS IN DT NNS CC VBZ VBG NNS IN NN NNS
1086.txt,combine with,a better solution is to combine hvc with the spatial pyramid matching model to achieve much higher recognition accuracy,O O O O O B O I O O O O O O O O O O O,DT JJR NN VBZ TO VB NN IN DT JJ NN NN NN TO VB RB JJR NN NN
1087.txt,the combination of,but the combination of hvc and spm will increase the dimensionality of feature vector,O B I I O O O O O O O O O O,CC DT NN IN NN CC NN MD VB DT NN IN NN NN
1088.txt,compared to,during the coding phase hvc uses the feature reconstruction strategy for coding which results in more accurate image representation compared to the vocabulary tree method,O O O O O O O O O O O O O O O O O O O B I O O O O,IN DT VBG NN NN VBZ DT NN NN NN IN NN WDT VBZ IN RBR JJ NN NN VBN TO DT NN NN NN
1090.txt,on one hand,this strategy on one hand reduces the computational complexity comparing with using all the codes in the vocabulary tree,O O B I I O O O O O O O O O O O O O O,DT NN IN CD NN VBZ DT JJ NN VBG IN VBG PDT DT NNS IN DT NN NN
1091.txt,on the other hand,on the other hand the hvc replaces the hard voting with feature reconstruction strategy for coding which avoids accumulating errors from root level and provides possibility to correct the quantization errors at lower levels,B I I I O O O O O O O O O O O O O O O O O O O O O O O O O O O O O O,IN DT JJ NN DT NN VBZ DT JJ NN IN NN NN NN IN NN WDT VBZ VBG NNS IN NN NN CC VBZ NN TO VB DT NN NNS IN JJR NNS
1092.txt,is used for,in x the hard voting is used for coding which may cause projection error lasting from the root of the vocabulary tree to leaves,O O O O O B I I O O O O O O O O O O O O O O O O,IN NN DT JJ NN VBZ VBN IN VBG WDT MD VB NN NN VBG IN DT NN IN DT NN NN TO NNS
1093.txt,accumulate into,a small quantization error at the root may accumulate into a large quantization error at the leave nodes,O O O O O O O O B I O O O O O O O O,DT JJ NN NN IN DT NN MD VB IN DT JJ NN NN IN DT NN NNS
1094.txt,more than,hvc coding can solve this problem because it has more than one path through down the vocabulary tree which uses codes with different parent nodes to reconstruct a descriptor,O O O O O O O O O B I O O O O O O O O O O O O O O O O O O,NN NN MD VB DT NN IN PRP VBZ JJR IN CD NN IN IN DT NN NN WDT VBZ NNS IN JJ NN NNS TO VB DT NN
1096.txt,such as,given the statistical representation of hvc features iris image classification becomes a standard pattern recognition problem and well established classificr such as svm can be used to predict the class labels,O O O O O O O O O O O O O O O O O O O O B I O O O O O O O O O,VBN DT JJ NN IN NN NNS VBP NN NN VBZ DT JJ NN NN NN CC RB VBN NN JJ IN NN MD VB VBN TO VB DT NN NNS
1099.txt,there are many ways to,there are many ways to make counterfeit iris patterns and fig,B I I I I O O O O O O,EX VBP JJ NNS TO VB NN NN NNS CC NN
1101.txt,it is a challenging task to,it is a challenging task to discriminate all these kinds of fake iris images and genuine iris images,B I I I I I O O O O O O O O O O O O,PRP VBZ DT JJ NN TO VB PDT DT NNS IN JJ NN NNS CC JJ NN NNS
1102.txt,based on,here a promising iris liveness detection method is developed based on the proposed iris image classification method,O O O O O O O O O B I O O O O O O,RB DT JJ NN NN NN NN VBZ VBN VBN IN DT VBN NN NN NN NN
1103.txt,in recent years,because of the importance of iris liveness detection some iris image databases containing iris images with cosmetic contact lenses have been published in public domain in recent years,O O O O O O O O O O O O O O O O O O O O O O O O O B I I,IN IN DT NN IN NN NN NN DT JJ NN NNS VBG NN NNS IN JJ NN NNS VBP VBN VBN IN JJ NN IN JJ NNS
1106.txt,are regarded as,in our research both iris images without contact lenses and with soft contact lenses are regarded as genuine iris images because iris texture patterns are still visible through soft contact lenses to achieve correct identification,O O O O O O O O O O O O O O B I I O O O O O O O O O O O O O O O O O O,IN PRP$ NN CC NN NNS IN NN NNS CC IN JJ NN NNS VBP VBN IN JJ NN NNS IN NN NN NNS VBP RB JJ IN JJ NN NNS TO VB JJ NN
1107.txt,are treated as,and the iris images with cosmetic contact lenses are treated as fake samples,O O O O O O O O B I I O O,CC DT NN NNS IN JJ NN NNS VBP VBN IN JJ NNS
1110.txt,is used to,therefore we developed a more comprehensive database namely casia iris fake for iris liveness detection is used to capture a large number of fake iris images,O O O O O O O O O O O O O O O B I I O O O O O O O O,RB PRP VBD DT RBR JJ NN RB FW FW NN IN NN NN NN VBZ VBN TO VB DT JJ NN IN JJ NN NNS
1112.txt,are useful for,these four kinds of typical fake iris images have seemingly realistic iris texture and are useful for testing the performance of iris liveness detection methods,O O O O O O O O O O O O O O B I I O O O O O O O O,DT CD NNS IN JJ JJ NN NNS VBP RB JJ NN NN CC VBP JJ IN VBG DT NN IN NN NN NN NNS
1113.txt,are described as follows,approaches to generate these fake iris patterns are described as follows,O O O O O O O B I I I,NNS TO VB DT JJ NN NNS VBP VBN IN VBZ
1120.txt,is used to,some volunteers are asked to wear these contact lens and then an iris device is used to capture iris images of these subjects,O O O O O O O O O O O O O O B I I O O O O O O,DT NNS VBP VBN TO VB DT NN NN CC RB DT NN NN VBZ VBN TO VB NN NNS IN DT NNS
1126.txt,is used to,the idea of iris image synthesis is used to generate fake iris images based on the contact dataset,O O O O O O B I I O O O O O O O O O,DT NN IN NN NN NN VBZ VBN TO VB JJ NN NNS VBN IN DT NN NN
1127.txt,both and,we adopt the patch based sampling method for synthesis and both intensity and texture features are considered to select sampling patches with smooth transition boundaries,O O O O O O O O O O B O I O O O O O O O O O O O O,PRP VBP DT NN JJ NN NN IN NN CC CC NN CC NN NNS VBP VBN TO VB NN NNS IN JJ NN NNS
1130.txt,are carried out to,three experiments are carried out to test the performance of iris liveness detection methods under different conditions,O O B I I I O O O O O O O O O O O,CD NNS VBP VBN RP TO VB DT NN IN NN NN NN NNS IN JJ NNS
1133.txt,the overall performance of,to evaluate the overall performance of iris liveness detection methods the four fake iris image datasets of casia iris fake are combined together,O O B I I I O O O O O O O O O O O O O O O O O,TO VB DT JJ NN IN NN NN NN NNS DT CD JJ NN NN NNS IN FW FW NN VBP VBN RB
1137.txt,be drawn from,a number of conclusions can be drawn from the experimental results,O O O O O B I I O O O,DT NN IN NNS MD VB VBN IN DT JJ NNS
1138.txt,based on,firstly all iris image classification methods based on bow can achieve high accuracy in detection of various fake iris patterns,O O O O O O B I O O O O O O O O O O O O,RB DT JJ NN NN NNS VBN IN NN MD VB JJ NN IN NN IN JJ JJ NN NNS
1139.txt,based on,secondly the iris liveness detection methods based on learned bow model generally perform better than the bow model without learning such as lbp,O O O O O O B I O O O O O O O O O O O O O O O,RB DT NN NN NN NNS VBN IN VBN NN NN RB VBP RBR IN DT NN NN IN VBG JJ IN NN
1141.txt,improve the accuracy of,fourthly spm can slightly improve the accuracy of both llc and hvc with the cost of much higher dimensionality of feature vector,O O O O B I I I O O O O O O O O O O O O O O,RB NN MD RB VB DT NN IN CC NN CC NN IN DT NN IN RB JJR NN IN NN NN
1142.txt,better performance than,hvc with two levels of spm can already achieve better performance than llc with three levels of spm,O O O O O O O O O B I I O O O O O O,NN IN CD NNS IN NN MD RB VB JJR NN IN NN IN CD NNS IN NN
1143.txt,is not critical to,the experimental results demonstrate the spatial distribution information of iris texture primitives is not critical to iris image classification,O O O O O O O O O O O O B I I I O O O,DT JJ NNS VBP DT JJ NN NN IN NN NN NNS VBZ RB JJ TO VB NN NN
1144.txt,such as,but spatial operators such as spm can provide complementary information to bow,O O O B I O O O O O O O,CC JJ NNS JJ IN NN MD VB JJ NN TO VB
1145.txt,it is suggested to,so it is suggested to combine hvc and spm for detection of fake iris patterns in highly secure applications,O B I I I O O O O O O O O O O O O O O,IN PRP VBZ VBN TO VB NN CC NN IN NN IN JJ NN NNS IN RB JJ NNS
1148.txt,are performed on,all the methods are performed on the whole normalized iris image without dividing it into small blocks,O O O B I I O O O O O O O O O O O,PDT DT NNS VBP VBN IN DT JJ VBN NN NN IN VBG PRP IN JJ NNS
1149.txt,are used as,for the four datasets of casia iris fake we use 100 fake and 100 genuine iris images as training samples and the other images are used as the testing samples,O O O O O O O O O O O O O O O O O O O O O O O O B I I O O O,IN DT CD NNS IN FW FW NN PRP VBP CD JJ CC CD JJ NN NNS IN NN NNS CC DT JJ NNS VBP VBN IN DT NN NNS
1150.txt,defined by,for nd contact we use the setting of training and testing datasets defined by the database provider i e,O O O O O O O O O O O O B I O O O O O,IN NN NN PRP VBP DT NN IN NN CC NN NNS VBN IN DT NN NN FW SYM
1152.txt,the most important issues,we can learn from the experimental results in this section what are the most important issues in development of an effective iris liveness detection method,O O O O O O O O O O O O B I I I O O O O O O O O O,PRP MD VB IN DT JJ NNS IN DT NN WP VBP DT RBS JJ NNS IN NN IN DT JJ NN NN NN NN
