1846.txt,as a reference for,mora propose inter component prediction of quadtree partitions using the video quadtree as a reference for limitation and prediction of the depth quadtree reporting significant encoder complexity reduction and small depth bit rate gains for 3d video extension of hevc,O O O O O O O O O O O O B I I I O O O O O O O O O O O O O O O O O O O O O O O O,NNS VBP NN NN NN IN NN NNS VBG DT NN NN IN DT NN IN NN CC NN IN DT NN NN VBG JJ NN NN NN CC JJ NN NN NN NNS IN JJ NN NN IN NN
1849.txt,in contrast to,in contrast to the approaches proposed in this paper these extend mv hevc by additional modes and methods without integrating and evaluating the effect of the view synthesis optimization distortion metric,B I I O O O O O O O O O O O O O O O O O O O O O O O O O O O O,IN NN TO DT NNS VBN IN DT NN DT VBP FW FW IN JJ NNS CC NNS IN VBG CC VBG DT NN IN DT NN NN NN NN NN
1851.txt,the important new contributions are,the important new contributions are the mesh extraction algorithm that smoothly integrates in the decoder the specially adapted set of modeling functions and corresponding prediction modes and the enhancement of the constant offset residual concept for fully replacing transform residual coding in all stages of the depthrelated intra encoder and decoder,B I I I I O O O O O O O O O O O O O O O O O O O O O O O O O O O O O O O O O O O O O O O O O O O O O O,DT JJ JJ NNS VBP DT NN NN NN WDT RB VBZ IN DT NN DT RB VBN NN IN NN NNS CC JJ NN NNS CC DT NN IN DT NN VBD JJ NN IN RB VBG VB JJ NN IN DT NNS IN DT VBN NN NN CC NN
1852.txt,the main principle of our approach is,the main principle of our approach is approximation of the signal of a depth block by modeling functions based on geometric primitives that allow representing the scene surface with a minimum number of triangles,B I I I I I I O O O O O O O O O O O O O O O O O O O O O O O O O O O,DT JJ NN IN PRP$ NN VBZ NN IN DT NN IN DT NN NN IN NN NNS VBN IN JJ NNS WDT VBP VBG DT NN NN IN DT JJ NN IN NNS
1855.txt,as well as,the details are explained in section iii including intra prediction and inter component prediction as well as constant offset residual coding in the spatial domain,O O O O O O O O O O O O O O B I I O O O O O O O O,DT NNS VBP VBN IN NN LS VBG JJ NN CC NN NN NN RB RB IN JJ VBN JJ NN IN DT JJ NN
1856.txt,based on,section iv is on the application of our solution including codec integration based on 3d hevc and mesh extraction,O O O O O O O O O O O O B I O O O O O,NN NN VBZ IN DT NN IN PRP$ NN VBG NN NN VBN IN FW FW CC VB NN
1857.txt,are presented in,finally the results are presented in section v,O O O B I I O O,RB DT NNS VBP VBN IN NN LS
1858.txt,are adapted to,both are adapted to a specific depth signal feature namely plane fitting for areas with constant or slowly changing values and non rectangular block segmentation for sharp edges,O B I I O O O O O O O O O O O O O O O O O O O O O O O O,DT VBP VBN TO DT JJ NN NN NN RB NN JJ IN NNS IN JJ CC RB VBG NNS CC JJ JJ NN NN IN JJ NNS
1859.txt,for instance,for instance wedgelet and plane models in x or wedgelet and contour models in x,B I O O O O O O O O O O O O O,IN NN NN CC NN NNS IN NN CC NN CC NN NNS IN NN
1862.txt,compared with,given a depth block with original sample values d u v deriving the best approximation by a plane model means finding the plane with parameters do mu and mv that causes the minimum distortion compared with the original signal,O O O O O O O O O O O O O O O O O O O O O O O O O O O O O O O O O O B I O O O,VBN DT NN NN IN JJ NN NNS FW FW LS VBG DT JJS NN IN DT NN NN VBZ VBG DT NN IN NNS VBP NN CC NN WDT VBZ DT JJ NN VBN IN DT JJ NN
1863.txt,the general approach for,the general approach for deriving the minimum distortion linear model for a given set of sample values is known as linear regression,B I I I O O O O O O O O O O O O O O O O O O,DT JJ NN IN VBG DT JJ NN NN NN IN DT VBN NN IN NN NNS VBZ VBN IN JJ NN
1865.txt,is extended to,for sample values assigned with more than one coordinate the method is extended to multiple linear regression,O O O O O O O O O O O B I I O O O,IN NN NNS VBN IN JJR IN CD NN DT NN VBZ VBN TO JJ JJ NN
1866.txt,according to,according to x the basic principle of this depth signal modeling approach is approximation of the signal of a rectangular block by a model that segments the area into two non rectangular regions where each of the segments is represented by a constant value,B I O O O O O O O O O O O O O O O O O O O O O O O O O O O O O O O O O O O O O O O O O O,VBG TO NN DT JJ NN IN DT NN NN NN NN VBZ NN IN DT NN IN DT JJ NN IN DT NN IN NNS DT NN IN CD JJ JJ NNS WRB DT IN DT NNS VBZ VBN IN DT JJ NN
1870.txt,is usually defined as,in the context of image and video processing the best reconstruction of a signal for a given set of candidate reconstructions is usually defined as the one that causes the minimum distortion compared with the original signal,O O O O O O O O O O O O O O O O O O O O O B I I I O O O O O O O O O O O O,IN DT NN IN NN CC NN NN DT JJS NN IN DT NN IN DT VBN NN IN NN NNS VBZ RB VBN IN DT NN WDT VBZ DT JJ NN VBN IN DT JJ NN
1871.txt,carrying out,translated to our wedgelet approach this means finding the model that results in the closest approximation of the original depth values d u v by carrying out a minimum distortion search with a set of candidate segmentation patterns,O O O O O O O O O O O O O O O O O O O O O O O O O B I O O O O O O O O O O O,VBN TO PRP$ JJ NN DT VBZ VBG DT NN WDT VBZ IN DT JJS NN IN DT JJ NN NNS FW FW LS IN VBG RP DT JJ NN NN IN DT NN IN NN NN NNS
1872.txt,is calculated from,finally the distortion is calculated from the difference between d u v and dm u v,O O O B I I O O O O O O O O O O,RB DT NN VBZ VBN IN DT NN IN FW FW LS CC FW FW LS
1873.txt,consists of,the algorithm for the minimum distortion search consists of calculating the distortion for each candidate segmentation pattern and selecting the one with the minimum value as the best wedgelet model approximation of the depth signal,O O O O O O O B I O O O O O O O O O O O O O O O O O O O O O O O O O O,DT NN IN DT JJ NN NN VBZ IN VBG DT NN IN DT NN NN NN CC VBG DT NN IN DT JJ NN IN DT JJS NN NN NN IN DT NN NN
1874.txt,depends on,the set of candidate partitions depends on the particular application and its constraints,O O O O O B I O O O O O O,DT NN IN NN NNS VBZ IN DT JJ NN CC PRP$ NNS
1875.txt,consist of,for definitely finding the wedgelet model with the overall minimum distortion the candidate set has to consist of the wedgelet patterns for all possible combinations of the line start and end positions,O O O O O O O O O O O O O O O O B I O O O O O O O O O O O O O O,IN RB VBG DT JJ NN IN DT JJ JJ NN DT NN NN VBZ TO VB IN DT NN NNS IN DT JJ NNS IN DT NN NN CC NN NNS
1879.txt,in contrast to,in contrast to wedgelet models any complex shaped object edge can be approximated by a contour model,B I I O O O O O O O O O O O O O O,IN NN TO JJ NNS DT JJ JJ NN NN MD VB VBN IN DT NN NN
1882.txt,based on,here the partition is not derived based on a set of candidate segmentations but by direct image segmentation of the depth block,O O O O O O B I O O O O O O O O O O O O O O,RB DT NN VBZ RB VBN VBN IN DT NN IN NN NNS CC IN JJ NN NN IN DT NN NN
1883.txt,the most suitable method for this purpose is,the most suitable method for this purpose is thresholding,B I I I I I I I O,DT RBS JJ NN IN DT NN VBZ VBG
1885.txt,is separately applied to,adaptive thresholding means that the image is subdivided into individual subimages and the thresholding is separately applied to each of them,O O O O O O O O O O O O O O B I I I O O O,JJ NN VBZ IN DT NN VBZ VBN IN JJ NNS CC DT NN VBZ RB VBN TO DT IN PRP
1886.txt,apply for,we apply adaptive thresholding for deriving the contour segmentation of a depth block,O B O O I O O O O O O O O,PRP VBP JJ NN IN VBG DT NN NN IN DT NN NN
1888.txt,be used for,the geometry based depth modeling approach introduced in section ii can be used for efficient depth compression by taking advantage of its quality to closely approximate the signal of a depth block for predictive coding,O O O O O O O O O O O B I I O O O O O O O O O O O O O O O O O O O O O,DT NN JJ NN NN NN VBN IN NN LS MD VB VBN IN JJ NN NN IN VBG NN IN PRP$ NN TO RB JJ DT NN IN DT NN NN IN JJ NN
1890.txt,is typically based on,at the encoder the decision on whether and to what extend estimated information is transmitted to the decoder is typically based on a cost function that balances the tradeoff between rate and distortion referred to as rate distortion optimization,O O O O O O O O O O O O O O O O O O B I I I O O O O O O O O O O O O O O O O O,IN DT NN DT NN IN IN CC TO WP VB VBN NN VBZ VBN TO DT NN VBZ RB VBN IN DT NN NN WDT VBZ DT NN IN NN CC NN VBN TO IN NN NN NN
1891.txt,are required for,the following four sections introduce the estimation prediction and signaling methods that are required for implementing our depth signal modeling in an mvd coding framework,O O O O O O O O O O O O B I I O O O O O O O O O O,DT JJ CD NNS VBP DT NN NN CC NN NNS WDT VBP VBN IN VBG PRP$ NN NN NN IN DT JJ NN NN
1892.txt,according to,according to x intra coding of hevc basically consists of a number of prediction modes together with transform coding of the residual,B I O O O O O O O O O O O O O O O O O O O O,VBG TO NN NN NN IN NN RB VBZ IN DT NN IN NN NNS RB IN VB NN IN DT JJ
1894.txt,introduced in,based on the geometric plane and wedgelet models introduced in section ii we developed the following novel intra picture prediction methods for depth coding,O O O O O O O O B I O O O O O O O O O O O O O O,VBN IN DT JJ NN CC NN NNS VBN IN NN LS PRP VBD DT VBG JJ JJ NN NN NNS IN NN NN
1895.txt,the principle of,the principle of this intra coding method is predicting a plane model from the information of previously coded blocks in the same picture i e intra prediction,B I I O O O O O O O O O O O O O O O O O O O O O O O O,DT NN IN DT JJ NN NN VBZ VBG DT NN NN IN DT NN IN RB VBN NNS IN DT JJ NN FW LS JJ NN
1896.txt,consists of,like for planar and dc intra modes in hevc the reference information for prediction consists of the spatially neighboring samples from left and top adjacent blocks,O O O O O O O O O O O O O O B I O O O O O O O O O O,IN IN NN CC FW FW NNS IN NN DT NN NN IN NN VBZ IN DT RB JJ NNS IN JJ CC JJ JJ NNS
1898.txt,is shown in,the plane prediction process is shown in fig 4,O O O O B I I O O,DT NN NN NN VBZ VBN IN NN CD
1899.txt,according to,according to x the plane model of a depth block is described by the three parameters offset do horizontal slope mu and vertical slope mv,B I O O O O O O O O O O O O O O O O O O O O O O O,VBG TO NN DT NN NN IN DT NN NN VBZ VBN IN DT CD NNS VBN VBP JJ NN NN CC JJ NN NN
1901.txt,in contrast to,in contrast to that the planar mode in hevc has no simple geometric description as it linearly interpolates neighboring samples which results in a smooth surface with a plane like characteristic,B I I O O O O O O O O O O O O O O O O O O O O O O O O O O O O,IN NN TO IN DT JJ NN IN NN VBZ DT JJ JJ NN IN PRP RB VBZ JJ NNS WDT VBZ IN DT JJ NN IN DT NN IN NN
1902.txt,in contrast to,in contrast to that the dc mode in hevc has no simple geometric description as the predicted signal is subsequently filtered along the left and top edges,B I I O O O O O O O O O O O O O O O O O O O O O O O O,IN NN TO IN DT NN NN IN NN VBZ DT JJ JJ NN IN DT VBN NN VBZ RB VBN IN DT JJ CC JJ NNS
1903.txt,according to,according to x the principle of this intra coding method is estimating the optimum wedgelet segmentation at the encoder by carrying out the minimum distortion search introduced in section ii b1 and transmitting the segmentation information in the bitstream,B I O O O O O O O O O O O O O O O O O O O O O O O O O O O O O O O O O O O O O,VBG TO NN DT NN IN DT JJ NN NN VBZ VBG DT JJ NN NN IN DT NN IN VBG RP DT JJ NN NN VBN IN NN LS NN CC VBG DT NN NN IN DT NN
1904.txt,in general,in general the coding performance of this approach benefits from a low distortion using the best wedgelet segmentation for reconstruction at the decoder but suffers from the additional rate required for transmitting the segmentation information,B I O O O O O O O O O O O O O O O O O O O O O O O O O O O O O O O O O,IN JJ DT VBG NN IN DT NN NNS IN DT JJ NN VBG DT JJS NN NN IN NN IN DT NN CC VBZ IN DT JJ NN VBN IN VBG DT NN NN
1906.txt,result from,a solution that meets both requirements is given as wedgelet pattern lookup table for a given coding block of size n n the lookup table is a list of w wedgelet segmentation patterns that result from combining all possible line start and end positions,O O O O O O O O O O O O O O O O O O O O O O O O O O O O O O O O O O B I O O O O O O O O,DT NN WDT VBZ DT NNS VBZ VBN IN JJ NN NN NN IN DT VBN NN NN IN NN NN NN DT NN NN VBZ DT NN IN FW FW NN NNS WDT VBP IN VBG DT JJ NN NN CC NN NNS
1907.txt,compared with,compared with other solutions these lookup tables have the following advantages,B I O O O O O O O O O,VBN IN JJ NNS DT NN NNS VBP DT JJ NNS
1908.txt,is carried out,the complexity of the estimation process is reduced as segmentation patterns do not have to be generated every time the minimum distortion search is carried out and redundant segmentations are implicitly excluded from being tested,O O O O O O O O O O O O O O O O O O O O O O O B I I O O O O O O O O O,DT NN IN DT NN NN VBZ VBN IN NN NNS VBP RB VB TO VB VBN DT NN DT JJ NN NN VBZ VBN RP CC JJ NNS VBP RB VBN IN VBG VBN
1909.txt,the principle of,the principle of this intra coding method is predicting the wedgelet segmentation from the information of previously coded blocks in the same picture,B I I O O O O O O O O O O O O O O O O O O O O,DT NN IN DT JJ NN NN VBZ VBG DT JJ NN IN DT NN IN RB VBN NNS IN DT JJ NN
1912.txt,is shown in,the intra prediction of a wedgelet segmentation is shown in fig,O O O O O O O B I I O,DT JJ NN IN DT JJ NN VBZ VBN IN NN
1914.txt,is predicted from,following the principle of directional intra prediction in hevc the wedgelet segmentation of the current block is predicted from the information of the left and top neighboring blocks that are already decoded and reconstructed,O O O O O O O O O O O O O O O O B I I O O O O O O O O O O O O O O O,VBG DT NN IN JJ JJ NN IN NN DT JJ NN IN DT JJ NN VBZ VBN IN DT NN IN DT JJ CC JJ JJ NNS WDT VBP RB VBN CC VBN
1915.txt,be calculated from,in this case the reference block has to be of type wedgelet such that the gradient mref can be calculated from the start and end points of the separation line,O O O O O O O O O O O O O O O O O O B I I O O O O O O O O O,IN DT NN DT NN NN VBZ TO VB IN NN NN JJ IN DT NN NN MD VB VBN IN DT NN CC NN NNS IN DT NN NN
1916.txt,are derived as,given that the line defined by sref and mref intersects the current block sp and ep are derived as their intersection points with border samples of the current block,O O O O O O O O O O O O O O O O B I I O O O O O O O O O O,VBN IN DT NN VBN IN NN CC NN VBZ DT JJ NN NN CC NN VBP VBN IN PRP$ NN NNS IN NN NNS IN DT JJ NN
1917.txt,it is not available,the overall process first considers the top block for prediction and if it is not available or applicable the left block is used,O O O O O O O O O O O O B I I I O O O O O O O,DT JJ NN RB VBZ DT JJ NN IN NN CC IN PRP VBZ RB JJ CC JJ DT JJ NN VBZ VBN
1921.txt,based on,based on x inter component prediction for the wedgelet and contour segmentations introduced in section ii b are considered,B I O O O O O O O O O O O O O O O O O,VBN IN NN NN NN NN IN DT NN CC NN NNS VBN IN NN LS NN VBP VBN
1922.txt,consist of,for both of them estimation at the encoder and reconstruction at the decoder are identical and only consist of the inter component prediction process such that no additional information has to be signaled in the bitstream,O O O O O O O O O O O O O O O O O B I O O O O O O O O O O O O O O O O O,IN DT IN PRP NN IN DT NN CC NN IN DT NN VBP JJ CC RB VBP IN DT NN NN NN NN JJ IN DT JJ NN VBZ TO VB VBN IN DT NN
1924.txt,depends on,regarding coding efficiency these two modes gain from a very low rate while the distortion depends on how consistent the object edges in video and depth are,O O O O O O O O O O O O O O O B I O O O O O O O O O O,VBG VBG NN DT CD NNS NN IN DT RB JJ NN IN DT NN VBZ IN WRB JJ DT NN VBZ IN NN CC NN VBP
1925.txt,as described in,the wedgelet segmentation of the current depth block is predicted from the video reference block by carrying out the minimum distortion search for the best matching wedgelet segmentation as described in section ii b1,O O O O O O O O O O O O O O O O O O O O O O O O O O O O B I I O O O,DT JJ NN IN DT JJ NN NN VBZ VBN IN DT NN NN NN IN VBG RP DT JJ NN NN IN DT JJS NN NN NN IN VBN IN NN LS NN
1926.txt,as introduced in,given the specific signal and distortion characteristics of depth we propose an alternative residual coding approach for depth intra that accompanies our concept of prediction signals based on geometric models as introduced in sections iii a and iii b,O O O O O O O O O O O O O O O O O O O O O O O O O O O O O O B I I O O O O O O,VBN DT JJ NN CC NN NNS IN NN PRP VBP DT JJ JJ NN NN IN NN NN WDT VBZ PRP$ NN IN NN NNS VBN IN JJ NNS IN VBN IN NNS LS DT CC LS NN
1927.txt,instead of,instead of per sample differences the transmitted residual of our method only consists of one constant offset value per partition in the spatial domain,B I O O O O O O O O O O O O O O O O O O O O O O,RB IN IN NN NNS DT JJ JJ IN PRP$ NN RB VBZ IN CD JJ VBN NN IN NN IN DT JJ NN
1928.txt,be referred to,this method will be referred to as constant offset residual coding,O O O B I I O O O O O,DT NN MD VB VBN TO IN NN VBD JJ NN
1929.txt,consists of,here the residual signal consists of two cor values for bsm and one for plane,O O O O B I O O O O O O O O O,RB DT JJ NN VBZ IN CD NN NNS IN NN CC CD IN NN
1930.txt,based on,this section is about the application of our depth intracoding approach based on geometric primitives with the first part addressing codec integration and the second mesh extraction,O O O O O O O O O O O B I O O O O O O O O O O O O O O,DT NN VBZ IN DT NN IN PRP$ NN VBG NN VBN IN JJ NNS IN DT JJ NN VBG NN NN CC DT JJ NN NN
1931.txt,as a basic framework for,for integrating the proposed depth intra coding methods we select 3d hevc as a basic framework for mvd compression,O O O O O O O O O O O O B I I I I O O,IN VBG DT VBN NN NN NN NNS PRP VBP FW FW IN DT JJ NN IN NN NN
1932.txt,builds upon,3d hevc builds upon mv hevc which supports efficient compression of mvv with inter view prediction,O O B I O O O O O O O O O O O O,FW FW VBZ IN FW FW WDT VBZ JJ NN IN NN IN NN NN NN
1933.txt,due to,due to the layer design mv hevc can be extended by additional depth layers for supporting mvd in a straightforward way,B I O O O O O O O O O O O O O O O O O O O,JJ TO DT NN NN FW FW MD VB VBN IN JJ NN NNS IN VBG NN IN DT JJ NN
1937.txt,be categorized by,these can be categorized by those specific to video or depth and those for intra or inter coding,O O B I I O O O O O O O O O O O O O,DT MD VB VBN IN DT JJ TO NN CC NN CC DT IN NN CC NN NN
1938.txt,is further improved by,the depth coding performance is further improved by disabling deblocking filters and including some special encoder optimizations in 3d hevc,O O O O B I I I O O O O O O O O O O O O,DT NN NN NN VBZ RB VBN IN VBG VBG NNS CC VBG DT JJ NN NNS IN FW FW
1940.txt,has an significant effect on,by changing the distortion metric for depth vso has an significant effect on rdo and the related decisions at the encoder,O O O O O O O O B I I I I O O O O O O O O,IN VBG DT NN NN IN NN NN VBZ DT JJ NN IN NN CC DT JJ NNS IN DT NN
1942.txt,described in,given this reference the integration of the methods described in section iii requires the following changes for depth intra blocks,O O O O O O O O B I O O O O O O O O O O,VBN DT NN DT NN IN DT NNS VBN IN NN LS VBZ DT JJ NNS IN NN NN NNS
1945.txt,is replaced by,as the second main module the regular tqr coding is replaced by our cor coding method,O O O O O O O O O B I I O O O O,IN DT JJ JJ NN DT JJ NN NN VBZ VBN IN PRP$ NN NN NN
1946.txt,such as,the integration of these main modules includes several minor changes and optimizations for depth intra coding such as signaling and binarization of related syntax elements or disabling reference sample smoothing,O O O O O O O O O O O O O O O O B I O O O O O O O O O O O O,DT NN IN DT JJ NNS VBZ JJ JJ NNS CC NNS IN NN NNS VBG JJ IN NN CC NN IN JJ NN NNS CC VBG NN NN VBG
1947.txt,according to,furthermore we use the fast search strategy for minimum distortion wedgelet derivation according to x which leads to a substantial complexity reduction especially in combination with vso,O O O O O O O O O O O O B I O O O O O O O O O O O O O,RB PRP VBP DT JJ NN NN IN JJ NN NN NN VBG TO NN WDT VBZ TO DT JJ NN NN RB IN NN IN NN
1948.txt,has the effect,regarding the encoder estimation of cor values vso has the effect that values derived according to 9 and 10 not necessarily result in the minimum distortion,O O O O O O O O B I I O O O O O O O O O O O O O O O,VBG DT NN NN IN NN NNS NN VBZ DT NN WDT VBZ VBN VBG TO CD CC CD RB RB VB IN DT JJ NN
1949.txt,are derived by,thus with vso the optimal cor values are derived by a minimum distortion search,O O O O O O O B I I O O O O,RB IN NN DT JJ NN NNS VBP VBN IN DT JJ NN NN
1950.txt,be referred to,altogether the resulting codec will be referred to as geometry based depth intra extension,O O O O O B I I O O O O O O,RB DT VBG NN MD VB VBN TO IN NN JJ NN NN NN
1951.txt,based on,interoperability between 3d video based on the mvd representation and applications in the 3d computer graphics domain can be achieved by converting the depth signal to a polygon mesh representation,O O O O B I O O O O O O O O O O O O O O O O O O O O O O O O,NN IN JJ NN VBN IN DT NN NN CC NNS IN DT JJ NN NNS NN MD VB VBN IN VBG DT NN NN TO DT NN NN NN
1953.txt,consist of,such surface meshes typically consist of triangular faces described by the position of so called vertices in 3d scene space and their connectivity,O O O O B I O O O O O O O O O O O O O O O O O,JJ NN NNS RB VBP IN JJ NNS VBN IN DT NN IN RB VBN NNS IN JJ NN NN CC PRP$ NN
1955.txt,lead to,in the case of depth maps adjacent samples with an identical depth value lead to collinear and coplanar vertices such that regions of constant depth require a smaller number of vertices,O O O O O O O O O O O O O B I O O O O O O O O O O O O O O O O,IN DT NN IN NN VBZ JJ NNS IN DT JJ NN NN NN TO NN CC NN NNS JJ IN NNS IN JJ NN VBP DT JJR NN IN NNS
1956.txt,in contrast to,in contrast to this general approach gdi is explicitly designed for supporting mesh extraction with a very small number of triangles,B I I O O O O O O O O O O O O O O O O O O,IN NN TO DT JJ NN NN VBZ RB VBN IN VBG NN NN IN DT RB JJ NN IN NNS
1957.txt,due to,due to the geometry based models in combination with cor and disabling smoothing deblocking filtering of reconstructed samples,B I O O O O O O O O O O O O O O O O,JJ TO DT NN VBN NNS IN NN IN NN CC VBG NN NN VBG IN JJ NNS
1962.txt,as well as,for contour blocks as well as for all other blocks,O O O B I I O O O O,IN NN NNS RB RB IN IN DT JJ NNS
1963.txt,consists of,the initial set consists of the four corner vertices,O O O B I O O O O,DT JJ NN VBZ IN DT CD NN NNS
1966.txt,is formed by,here the convex hull is formed by the k vertices that correspond to samples on the picture border,O O O O B I I O O O O O O O O O O O,RB DT NN NN VBZ VBN IN DT NN NNS WDT VBP TO NNS IN DT NN NN
1967.txt,is integrated in,the described method is integrated in our 3d hevc framework as an alternative decoder output with aligned new processes on all levels of the decoder from blocks to layers,O O O B I I O O O O O O O O O O O O O O O O O O O O O O O,DT VBN NN VBZ VBN IN PRP$ FW FW NN IN DT JJ NN NN IN VBN JJ NNS IN DT NNS IN DT NN IN NNS TO NNS
1969.txt,according to,this includes eight test data sets a camera setup with three original and six synthesized views layer coding order and inter layer dependencies according to fig,O O O O O O O O O O O O O O O O O O O O O O O B I O,DT VBZ CD NN NNS VBZ DT NN NN IN CD JJ CC CD VBN NNS NN NN NN CC NN NN NNS VBG TO NN
1973.txt,due to,due to the large impact on the encoder rdo decisions and thus on the depth coding performance some additional experiments are conducted with vso disabled,B I O O O O O O O O O O O O O O O O O O O O O O O,JJ TO DT JJ NN IN DT NN NN NNS CC RB IN DT NN VBG NN DT JJ NNS VBP VBN IN NN VBN
1974.txt,refer to,unless explicitly specified differently all results in this section refer to the configuration with all intra coding structure and vso enabled,O O O O O O O O O B I O O O O O O O O O O,IN RB VBN RB DT NNS IN DT NN VBP TO DT NN IN DT JJ NN NN CC NN VBD
1975.txt,according to,for implementing the reference framework and our gdi extension according to section iv a we use version 11 of the 3d hevc reference software,O O O O O O O O O B I O O O O O O O O O O O O O,IN VBG DT NN NN CC PRP$ NN NN VBG TO NN NN DT PRP VBP NN CD IN DT FW FW NN NN
1976.txt,introduced in,moreover the decoder of our coding framework is extended by the mesh extraction method introduced in section iv b,O O O O O O O O O O O O O O B I O O O,RB DT NN IN PRP$ NN NN VBZ VBN IN DT NN NN NN VBN IN NN NN NN
1978.txt,the impact of,this second configuration allows one to clearly evaluate and classify the impact of gdi on top of the reference,O O O O O O O O O O B I I O O O O O O,DT JJ NN VBZ CD TO RB VB CC VB DT NN IN NN IN NN IN DT NN
1981.txt,be taken into account,for assessing the magnitude of the gains it has to be taken into account that only a very small portion of the total rate can be influenced by gdi while the video coding parts of reference methods and gdi are identical,O O O O O O O O O O B I I I O O O O O O O O O O O O O O O O O O O O O O O O O O O,IN VBG DT NN IN DT NNS PRP VBZ TO VB VBN IN NN IN RB DT RB JJ NN IN DT JJ NN MD VB VBN IN NN IN DT NN NN NNS IN NN NNS CC NNS VBP JJ
